{
 "paperId": "design-technology-hsc-nesa-2021-hsc-design-and-technology",
 "model": "claude-opus-4-8",
 "ts": 1783075921,
 "tags": {
  "q01.pdf": {
   "syllabusRefs": [
    "H1.1"
   ],
   "type": "mc",
   "topic": "Factors of design (aesthetics)",
   "module": "Designing and Producing",
   "confidence": 0.95,
   "qaVerdict": "good",
   "qaStage": "opus"
  },
  "q02.pdf": {
   "syllabusRefs": [
    "H4.3",
    "H1.1"
   ],
   "type": "mc",
   "topic": "Design process / developing design solutions",
   "module": "Designing and Producing",
   "confidence": 0.9,
   "qaVerdict": "good",
   "qaStage": "opus"
  },
  "q03.pdf": {
   "syllabusRefs": [
    "H4.3",
    "H2.2"
   ],
   "type": "mc",
   "topic": "Life cycle analysis as evaluation tool",
   "module": "Designing and Producing",
   "confidence": 0.9,
   "qaVerdict": "good",
   "qaStage": "opus"
  },
  "q04.pdf": {
   "syllabusRefs": [
    "H6.1",
    "H1.2"
   ],
   "type": "mc",
   "topic": "Intellectual property protection",
   "module": "Designing and Producing",
   "confidence": 0.9,
   "qaVerdict": "good",
   "qaStage": "opus"
  },
  "q05.pdf": {
   "syllabusRefs": [
    "H2.2",
    "H2.1"
   ],
   "type": "mc",
   "topic": "Designer's role in economic/community impact of design",
   "module": "Designing and Producing",
   "confidence": 0.88,
   "qaVerdict": "good",
   "qaStage": "opus"
  },
  "q06.pdf": {
   "syllabusRefs": [
    "H4.2",
    "H2.2"
   ],
   "type": "mc",
   "topic": "Efficient and sustainable product development",
   "module": "Designing and Producing",
   "confidence": 0.88,
   "qaVerdict": "good",
   "qaStage": "opus"
  },
  "q07.pdf": {
   "syllabusRefs": [
    "H2.1",
    "H6.2"
   ],
   "type": "mc",
   "topic": "Societal trends (cashless/paperless) and consumer benefit",
   "module": "Innovation and Emerging Technologies",
   "confidence": 0.9,
   "qaVerdict": "good",
   "qaStage": "opus"
  },
  "q08.pdf": {
   "syllabusRefs": [
    "H4.2",
    "H2.2"
   ],
   "type": "mc",
   "topic": "Ethical use of synthetic vs natural materials",
   "module": "Designing and Producing",
   "confidence": 0.9,
   "qaVerdict": "good",
   "qaStage": "opus"
  },
  "q09.pdf": {
   "syllabusRefs": [
    "H4.3",
    "H2.2"
   ],
   "type": "mc",
   "topic": "Evaluating products against brief (graph interpretation)",
   "module": "Designing and Producing",
   "confidence": 0.9,
   "qaVerdict": "good",
   "qaStage": "opus"
  },
  "q10.pdf": {
   "syllabusRefs": [
    "H6.2",
    "H2.2"
   ],
   "type": "mc",
   "topic": "Emerging technologies and sustainability alignment",
   "module": "Innovation and Emerging Technologies",
   "confidence": 0.9,
   "qaVerdict": "good",
   "qaStage": "opus"
  },
  "q11.pdf": {
   "syllabusRefs": [
    "H4.2",
    "H1.1"
   ],
   "type": "short",
   "topic": "PPE / WHS: annotated sketch and responding to a design brief",
   "module": "Designing and Producing",
   "confidence": 0.9,
   "qaVerdict": "good",
   "qaStage": "opus"
  },
  "q12.pdf": {
   "syllabusRefs": [
    "H1.2",
    "H2.1"
   ],
   "type": "short",
   "topic": "Effects of changes to work practices on the designer",
   "module": "Designing and Producing",
   "confidence": 0.88,
   "qaVerdict": "good",
   "qaStage": "opus"
  },
  "q13.pdf": {
   "syllabusRefs": [
    "H2.1",
    "H2.2"
   ],
   "type": "extended",
   "topic": "Why designers should consider the needs of society",
   "module": "Designing and Producing",
   "confidence": 0.9,
   "qaVerdict": "good",
   "qaStage": "opus"
  },
  "q14.pdf": {
   "syllabusRefs": [
    "H6.2",
    "H2.2"
   ],
   "type": "extended",
   "topic": "Legal and economic issues of innovative transport systems (drones, driverless trucks)",
   "module": "Innovation and Emerging Technologies",
   "confidence": 0.9,
   "qaVerdict": "good",
   "qaStage": "opus"
  }
 }
}